{
  "op_id": "33333333-0000-4000-8000-000000000016",
  "actor_id": "00000000-0000-4000-8000-0000000000a1",
  "asserted_at": "7338950400000000000",
  "kind": "or-set-update",
  "format_version": 1,
  "origin": { "kind": "manual" },
  "deps": [],
  "payload": {
    "partition": "00000000-0000-4000-8000-000000000001",
    "scenario_id": null,
    "actor": "00000000-0000-4000-8000-0000000000a1",
    "asserted_at": "7338950400000000000",
    "entity_id": "11111111-0000-4000-8000-000000000003",
    "field_id": "8b325050-8ae1-52b7-843a-1ac2efaf0e41",
    "op": "add",
    "element": { "str": "Praxis Cloud" },
    "valid_from": "1767225600000000",
    "valid_to": null,
    "layer": "actual",
    "write_options": null
  }
}
