{
  "op_id": "33333333-0000-4000-8000-000000000008",
  "actor_id": "00000000-0000-4000-8000-0000000000a1",
  "asserted_at": "7338950400000000000",
  "kind": "upsert-metamodel-batch",
  "format_version": 1,
  "origin": { "kind": "manual" },
  "deps": [],
  "payload": {
    "types": [
      {
        "type_id": "c8d3aeef-d3d2-5143-9c63-7e11c2f019a2",
        "applies_to": "node",
        "label": "Application",
        "is_abstract": false,
        "parent_type_id": null
      }
    ],
    "fields": [
      {
        "field_id": "d4c7fcfa-3c4c-5ceb-abd3-1fc14e28c273",
        "label": "disposition",
        "value_type": "str",
        "semantic_kind": "enum",
        "enum_values": ["Invest", "Tolerate", "Migrate", "Eliminate"],
        "cardinality_multi": false,
        "is_indexed": true
      }
    ],
    "type_fields": [
      {
        "type_id": "c8d3aeef-d3d2-5143-9c63-7e11c2f019a2",
        "field_id": "d4c7fcfa-3c4c-5ceb-abd3-1fc14e28c273",
        "is_required": false,
        "default_value": { "str": "Tolerate" },
        "override_default": false,
        "tighten_required": false
      }
    ],
    "edge_type_rules": [
      {
        "edge_type_id": "5189e2d3-0b57-520d-9829-40c3d731f863",
        "allowed_src_type_ids": ["c8d3aeef-d3d2-5143-9c63-7e11c2f019a2"],
        "allowed_dst_type_ids": ["88c36fbe-5c8e-5485-92eb-952a4636be57"],
        "semantic_direction": "source_to_target"
      }
    ],
    "validation": {
      "string_max_length": 256,
      "text_max_length": 4096,
      "enum_case_sensitive": false
    },
    "metamodel_version": "1.0.0",
    "metamodel_source": "core-v1.json"
  }
}
